{
  "schema_version": "1.0",
  "user": {
    "schema_version": "1.0",
    "user_id": "b7fc8e6b-69d6-4d23-a5ed-f939a860226a",
    "username": "demo.user",
    "created_at": "2026-07-20T09:00:00Z"
  },
  "csrf_token": "synthetic-csrf-token-for-contract-tests",
  "expires_at": "2026-07-20T17:00:00Z"
}
